identifier_adminDB,title,name_author 1,name1_URI,name_author 2,name2_URI,name_author 3,name3_URI,name_author 4,name4_URI,name_author 5,name5_URI,dateIssued,extent,identifier_isbn,identifier_issn,publisher,notes,abstract,language,typeofResource,form,URI_form,subject_geographic,URI_geo,subject_topic_LCSH,URI_topic,subject_topic_LCSH2,URI_topic2,subject_topic_LCSH3,URI_topic3,subject_topic_LCSH4,URI_topic4,subject_topic_NAF,URI_NAF_topic,record_source,project_title,repository,repository_URI,rights,rights URI
0116_000050_000368,Your Family's Rights under the New Fair Housing Law,Children's Defense Fund (U.S.),http://id.loc.gov/authorities/names/n80083301,,,,,,,,,1989,26,ISBN 938008749,,Children's Defense Fund (U.S.),,"This booklet introduces the reader to the Fair Housing Amendment Act of 1988, passed by Congress making it unlawful to discriminate against families with children and people with disabilities. The law was a strong response to reports across the country that families with children are very often victims of housing discfrimination. The booklet introduces the reader to the new law and helps the reader determine if he or she has been unfairly denied housing because of their children.",eng,text,reports,http://vocab.getty.edu/aat/300027267,United States,http://id.loc.gov/authorities/names/n78095330,Discrimination in housing,http://id.loc.gov/authorities/subjects/sh85038391,Housing,http://id.loc.gov/authorities/subjects/sh85062603,,,,,United States. Fair Housing Amendments Act of 1988,http://id.loc.gov/authorities/names/n88050733,"University of Tennessee, Knoxville. Libraries",Children's Defense Fund,Langston Hughes Library (Children's Defense Fund Haley Farm),http://id.loc.gov/authorities/names/no2017113530.html,In Copyright - Non-Commercial Use Permitted,http://rightsstatements.org/vocab/InC-NC/1.0/
0116_000050_000369,A Nation and Century Defining Time: Where Is America Going? How You Can Make a Difference: An Action Guide,Children's Defense Fund (U.S.). Action Council,http://id.loc.gov/authorities/names/no2004061976,,,,,,,,,2004,70,,,,,"This guide seeks to inform the public about the needs of children and families and how the budget and tax choices and policies in our nation affect them. Included are personal stories of millions of children and families and the choices we have as a people to build a more just nation and world. The CDF Action Council's longer term policy vision incorporated in the comprehensive Dodd-Miller Act to Leave No Child Behindis shared. State-buy-state tables on child poverty, child health coverge, state spending per public school pupil and per prisoner are also included.",eng,text,reports,http://vocab.getty.edu/aat/300027267,United States,http://id.loc.gov/authorities/names/n78095330,Family policy,http://id.loc.gov/authorities/subjects/sh85047060,Child welfare,http://id.loc.gov/authorities/subjects/sh85023396 ,Budget,http://id.loc.gov/authorities/subjects/sh85017602,,,,,"University of Tennessee, Knoxville. Libraries",Children's Defense Fund,Langston Hughes Library (Children's Defense Fund Haley Farm),http://id.loc.gov/authorities/names/no2017113530.html,In Copyright - Non-Commercial Use Permitted,http://rightsstatements.org/vocab/InC-NC/1.0/
0116_000050_000370,Mounting a Prenatal Care Campaign in Your Community,"Hughes, Dana",http://id.loc.gov/authorities/names/n86121010,,,,,,,,,1986,37,ISBN 938008560,,Children's Defense Fund (U.S.),,"This report analyzes the prenatal care services needs in communities and compares those needs with services available. The report emphasies the importance of prenatal health care for mothers and care for newborn babies and how good quality care helps prevent teen pregnancies, decreases low birthweight and the infant mortality rate, and assists in providing a strong basis for families.",eng,text,reports,http://vocab.getty.edu/aat/300027267,United States,http://id.loc.gov/authorities/names/n78095330,Prenatal care,http://id.loc.gov/authorities/subjects/sh85106374,Maternal and infant welfare ,http://id.loc.gov/authorities/subjects/sh85082098,,,,,,,"University of Tennessee, Knoxville. Libraries",Children's Defense Fund,Langston Hughes Library (Children's Defense Fund Haley Farm),http://id.loc.gov/authorities/names/no2017113530.html,In Copyright - Non-Commercial Use Permitted,http://rightsstatements.org/vocab/InC-NC/1.0/
0116_000050_000371,The West: Child Care Challenges,"Adams, Gina",," Schulman, Karen",,,,,,,,1998,80,,,Children's Defense Fund (U.S.),,"This report is a regional compilation of several state reports, each of which examines the range of child care challenges facing families in that state. State reports include Alaska, Arizona, California, Colorado, Hawaii, Idaho, Montana, Nevada, New Mexico, Oregon, Utah, Washington, and Wyoming.",eng,text,reports,http://vocab.getty.edu/aat/300027267,West (U.S.),http://id.loc.gov/authorities/subjects/sh85146140,Child care,http://id.loc.gov/authorities/subjects/sh85023354,Federal aid to child welfare,http://id.loc.gov/authorities/subjects/sh85047559,Child care services,http://id.loc.gov/authorities/subjects/sh85023355,,,,,"University of Tennessee, Knoxville. Libraries",Children's Defense Fund,Langston Hughes Library (Children's Defense Fund Haley Farm),http://id.loc.gov/authorities/names/no2017113530.html,In Copyright - Non-Commercial Use Permitted,http://rightsstatements.org/vocab/InC-NC/1.0/
0116_000050_000372,New Partnerships: Education's Stake in the Family Support Act of 1988,,,,,,,,,,,1988,31,,,,"A Statement of: American Public Welfare Association, Center for Law and Social Policy, Center for Study of Social Policy, CDF, Council of Chief State School Officers, Institute for Educational Leadership, National Alliance of Business, National Assoc. of State Boards of Educ., and National Governors' Association","This document highlights the aspects of the Family Support Act (FSA) that are relevantr to both the education and the public welfare communities, describes the opportunities that FSA oiffers for both systems to meet their own and shared goals for populations at risk, and emphasizes the importance and benefits of collaborative among education and the human services in implementing FSA.",eng,text,reports,http://vocab.getty.edu/aat/300027267,United States,http://id.loc.gov/authorities/names/n78095330,Welfare recipients,http://id.loc.gov/authorities/subjects/sh85146031,Child care services,http://id.loc.gov/authorities/subjects/sh85023355,,,,,United States. Family Support Act of 1988,http://id.loc.gov/authorities/names/n87851140,"University of Tennessee, Knoxville. Libraries",Children's Defense Fund,Langston Hughes Library (Children's Defense Fund Haley Farm),http://id.loc.gov/authorities/names/no2017113530.html,In Copyright - Non-Commercial Use Permitted,http://rightsstatements.org/vocab/InC-NC/1.0/
0116_000050_000373,What It Takes: Structuring Interagency Partnerships to Connect Children and Families with Comprehensive Services,"Melaville, Atelia",," Blank, Martin",,,,,,,,1991,53,,,,"A Joint Publication of the Education and Human Services Consortium: Amer. Public Welfare Assoc., Center for Law and Social Policy, Center for the Study of Social Policy, Child Welfare League of America, CDF, Council of Chief State School Officers, Council of Great City Schools, Educ. Commission of the States, Institute for Educational Leadership, Joining Forces, National Alliance of Business, National Assoc. of Counties, National Assembly of National Voluntary Health and Social Welfare Organizations, National Assoc. of Secondary School Principals, National Assoc. of State Boards of Educ., National Governors' Assoc., National League of Cities, National School Boards Assoc., National Youth Employment Coalition, U.S. Conference of Mayors, Wider Opportunities for Women, and the William T. Grant Foundation Commission on Work, Family, and Citizenship","This is the second in a series of publications published by the Education and Human Services Consortium, a loose-knit coalition of national organizations concerned with the interagency efforts to connect children and families with comprehensive services. The first publication,New Partnerships: Education's Stake in the Family Support Act of 1988, was aimed at state and local education and human services policy makers, administrators, and practitioners and explored the potential for collaboration among education and welkfare agencies in the implementation of the new law. This monoigraph looks at why local schools, health and welfare agencies, youth services agencies, community-based organizations, and others must join forces on behalf of children and families, and offers guidance based on emerging experience about how they can move forward together. A third publication in this series isThinking Collaboratively: Questiona and Answers to Help Policy Makers Improve Services for Children,published in 1991.",eng,text,reports,http://vocab.getty.edu/aat/300027267,United States,http://id.loc.gov/authorities/names/n78095330,Child welfare,http://id.loc.gov/authorities/subjects/sh85023396 ,Family services,http://id.loc.gov/authorities/subjects/sh88003551,,,,,,,"University of Tennessee, Knoxville. Libraries",Children's Defense Fund,Langston Hughes Library (Children's Defense Fund Haley Farm),http://id.loc.gov/authorities/names/no2017113530.html,In Copyright - Non-Commercial Use Permitted,http://rightsstatements.org/vocab/InC-NC/1.0/
0116_000050_000374,"State Developments in Child Care, Early Education, and School-Age Care 2002","Ewen, Danielle",," Hart, Ketherine",,,,,,,,2002,151,,,Children's Defense Fund (U.S.),,"This report provides highlights and updates regarding state actions on child care, early education, and school-age care issues during 2002. It includes a state-by-state snapshot of comparable state policies.",eng,text,reports,http://vocab.getty.edu/aat/300027267,United States,http://id.loc.gov/authorities/names/n78095330,Child care services,http://id.loc.gov/authorities/subjects/sh85023355,Federal aid to day care centers,http://id.loc.gov/authorities/subjects/sh85047564,,,,,,,"University of Tennessee, Knoxville. Libraries",Children's Defense Fund,Langston Hughes Library (Children's Defense Fund Haley Farm),http://id.loc.gov/authorities/names/no2017113530.html,In Copyright - Non-Commercial Use Permitted,http://rightsstatements.org/vocab/InC-NC/1.0/
0116_000050_000375,A Parent's Guide to Child Support,"Ebb, Nancy",http://id.loc.gov/authorities/names/no99034746,,,,,,,,,1999,40,,,Children's Defense Fund (U.S.),,"A guide to assist parents in obtaining child support payments, resolving paternity issues, and enforcing child support obligations",eng,text,reports,http://vocab.getty.edu/aat/300027267,United States,http://id.loc.gov/authorities/names/n78095330,Child support,http://id.loc.gov/authorities/subjects/sh85023394,Child welfare,http://id.loc.gov/authorities/subjects/sh85023396,,,,,,,"University of Tennessee, Knoxville. Libraries",Children's Defense Fund,Langston Hughes Library (Children's Defense Fund Haley Farm),http://id.loc.gov/authorities/names/no2017113530.html,In Copyright - Non-Commercial Use Permitted,http://rightsstatements.org/vocab/InC-NC/1.0/
0116_000050_000376,Stand up for Children Now!,Children's Defense Fund (U.S.). Action Council,http://id.loc.gov/authorities/names/no2004061976,,,,,,,,,2005,44,,,,,A guide aimed at addressing the poverty surrounding children in the United States,eng,text,reports,http://vocab.getty.edu/aat/300027267,United States,http://id.loc.gov/authorities/names/n78095330,Poor children,http://id.loc.gov/authorities/subjects/sh85104852,Child welfare,http://id.loc.gov/authorities/subjects/sh85023396,,,,,,,"University of Tennessee, Knoxville. Libraries",Children's Defense Fund,Langston Hughes Library (Children's Defense Fund Haley Farm),http://id.loc.gov/authorities/names/no2017113530.html,In Copyright - Non-Commercial Use Permitted,http://rightsstatements.org/vocab/InC-NC/1.0/
0116_000050_000377,Unshared Sacrifice: The House of Representatives' Shameful Assault on America's Children,Children's Defense Fund (U.S.),http://id.loc.gov/authorities/names/n80083301,,,,,,,,,1995,42,,,Children's Defense Fund (U.S.),,"This report details the cuts made by the House of Representatives in 1994 that conbtributed to major decrease in services to poor children and families. $30 billion were stripped from crucial child survival programs like SSI (Supplemental Security Income), AFDC (Aid to Families with Dependent Children), Foster Care and Adoption Assistance, the School Lunch Program, Child Care, Services to Disabled, Abused, and Neglected Children, and Child and Adult Food Program.",eng,text,reports,http://vocab.getty.edu/aat/300027267,United States,http://id.loc.gov/authorities/names/n78095330,Child welfare,http://id.loc.gov/authorities/subjects/sh85023396,Federal aid to child welfare,http://id.loc.gov/authorities/subjects/sh85047559,,,,,,,"University of Tennessee, Knoxville. Libraries",Children's Defense Fund,Langston Hughes Library (Children's Defense Fund Haley Farm),http://id.loc.gov/authorities/names/no2017113530.html,In Copyright - Non-Commercial Use Permitted,http://rightsstatements.org/vocab/InC-NC/1.0/
0116_000050_000378,Summary of Legislation Affecting Children in 1996,Children's Defense Fund (U.S.),http://id.loc.gov/authorities/names/n80083301,,,,,,,,,1996,27,,,,,"This memo provides a summary of what Congress did in 1996 that mostly directly affected children. Examples of legislation passed by the 104th Congress are a $54 billion cut in the safety net programs that benefitted the poorest children and families, proposals to wipe out Medicaid, food stamps, school and summer meals, and cuts to the Child and Adult Care Food Program, Foster Care, Adoption Assistance.",eng,text,memorandums,http://vocab.getty.edu/aat/300026906,United States,http://id.loc.gov/authorities/names/n78095330,Child welfare,http://id.loc.gov/authorities/subjects/sh85023396,Poor children,http://id.loc.gov/authorities/subjects/sh85104852,,,,,Child & Adult Care Food Program (U.S.),http://id.loc.gov/authorities/names/no97021869,"University of Tennessee, Knoxville. Libraries",Children's Defense Fund,Langston Hughes Library (Children's Defense Fund Haley Farm),http://id.loc.gov/authorities/names/no2017113530.html,In Copyright - Non-Commercial Use Permitted,http://rightsstatements.org/vocab/InC-NC/1.0/
0116_000050_000379,The Welfare Reform Debate: Implications for Child Care,"Blank, Helen",http://id.loc.gov/authorities/names/n86833543,,,,,,,,,1996,47,,,Children's Defense Fund (U.S.),,"This paper is intended to help child care advocates think about the many difficult and painful issues that could be raised if a state proposes to revamp its current child care system. The document should be viewed as a work in progress because of the uncertainty about the outcome of federal proposals. The paper reemphasizes CDF's stance on opposing any legislation that would significantly increase the need for child care assistance for welfare families without providing sufficient funding to meet the demand, that would jeopardize child care assistance for poor working families, or that would jeopardize the quality of child care.",eng,text,reports,http://vocab.getty.edu/aat/300027267,United States,http://id.loc.gov/authorities/names/n78095330,Child welfare,http://id.loc.gov/authorities/subjects/sh85023396,Child care services,http://id.loc.gov/authorities/subjects/sh85023355,Welfare recipients,http://id.loc.gov/authorities/subjects/sh85146031,,,,,"University of Tennessee, Knoxville. Libraries",Children's Defense Fund,Langston Hughes Library (Children's Defense Fund Haley Farm),http://id.loc.gov/authorities/names/no2017113530.html,In Copyright - Non-Commercial Use Permitted,http://rightsstatements.org/vocab/InC-NC/1.0/
0116_000050_000380,Windows of Opportunity: Ohio's Children and the 1998 Election,Children's Defense Fund--Ohio,http://id.loc.gov/authorities/names/n84039009,,,,,,,,,1998,34,ISBN 1881985202,,,,This report suggests nearly two dozen steps the next governor of Ohio and the legislature can take for children. Nearly all of the measures use existing funding or tax cuts in recognition of the need to finance increases in school funding.,eng,text,reports,http://vocab.getty.edu/aat/300027267,Ohio,http://id.loc.gov/authorities/names/n79049197,Child welfare,http://id.loc.gov/authorities/subjects/sh85023396,Federal aid to education,http://id.loc.gov/authorities/subjects/sh85047566,,,,,,,"University of Tennessee, Knoxville. Libraries",Children's Defense Fund,Langston Hughes Library (Children's Defense Fund Haley Farm),http://id.loc.gov/authorities/names/no2017113530.html,In Copyright - Non-Commercial Use Permitted,http://rightsstatements.org/vocab/InC-NC/1.0/
0116_000050_000381,The Midwest: Child Care Challenges,"Adams, Gina",," Schulman, Karen",,,,,,,,1998,85,,,Children's Defense Fund (U.S.),,"This report is a regional compilation of several state reports, each of which examines the range of child care challenges facing families in the state. States included are Illinois, Indiana, Iowa, Kansas, Michigan, Minnesota, Missouri, Nebraska, North Dakota, Ohio, South Dakota, and Wisconsin.",eng,text,reports,http://vocab.getty.edu/aat/300027267,Middle West,http://id.loc.gov/vocabulary/geographicAreas/n-usc,Child welfare,http://id.loc.gov/authorities/subjects/sh85023396,Child care services,http://id.loc.gov/authorities/subjects/sh85023355,,,,,,,"University of Tennessee, Knoxville. Libraries",Children's Defense Fund,Langston Hughes Library (Children's Defense Fund Haley Farm),http://id.loc.gov/authorities/names/no2017113530.html,In Copyright - Non-Commercial Use Permitted,http://rightsstatements.org/vocab/InC-NC/1.0/
0116_000050_000382,The Northeast: Child Care Challenges,"Adams, Gina",," Schulman, Karen",,,,,,,,1998,80,,,,,"This report is a regional compilation of several state reports, each of which examines the range of child care challenges facing families in that state. States included are Connecticut, Maine, massachusetts, New Hampshire, New Jersey, New York, Pennsylvania, Rhode Island, and Vermont.",eng,text,reports,http://vocab.getty.edu/aat/300027267,Northeastern States,http://id.loc.gov/vocabulary/geographicAreas/n-use,Child care services,http://id.loc.gov/authorities/subjects/sh85023355,Federal aid to child welfare,http://id.loc.gov/authorities/subjects/sh85047559,Federal aid to day care centers,http://id.loc.gov/authorities/subjects/sh85047564,,,,,"University of Tennessee, Knoxville. Libraries",Children's Defense Fund,Langston Hughes Library (Children's Defense Fund Haley Farm),http://id.loc.gov/authorities/names/no2017113530.html,In Copyright - Non-Commercial Use Permitted,http://rightsstatements.org/vocab/InC-NC/1.0/
0116_000050_000383,Child Support Reform: A State Checklist for Change,"Ebb, Nancy",http://id.loc.gov/authorities/names/no99034746,,,,,,,,,1994,10,,,Children's Defense Fund (U.S.),,This report focuses on state and Fedaral efforts to provide agencies who work for children to improve child support enforcement,eng,text,reports,http://vocab.getty.edu/aat/300027267,United States,http://id.loc.gov/authorities/names/n78095330,Child support,http://id.loc.gov/authorities/subjects/sh85023394,Child welfare,http://id.loc.gov/authorities/subjects/sh85023396,,,,,,,"University of Tennessee, Knoxville. Libraries",Children's Defense Fund,Langston Hughes Library (Children's Defense Fund Haley Farm),http://id.loc.gov/authorities/names/no2017113530.html,In Copyright - Non-Commercial Use Permitted,http://rightsstatements.org/vocab/InC-NC/1.0/
0116_000050_000384,Transitional Child Care: State Experiences and Emerging Policies under the Family Support Act,Children's Defense Fund (U.S.),http://id.loc.gov/authorities/names/n80083301,Center for Law and Social Policy,http://id.loc.gov/authorities/names/n80119580,,,,,,,1990,62,,,,Collaborated with the Center for Law and Social Policy,"CDF and the Center for Law and Social Policy (CLASP) jointly made this publication to provide insight into transitional child care policies and operations and to offer recommendations to policy makers and advocates. Transitional child care (TCC) is a new federal child care program that every state must have implemented by April 1, 1990. Established by the Family Support Act (FSA) of 1988, TCC is designed to help families that lose AFDC for income-related reasons to meet their child care needs for one year after AFDC ends.",eng,text,reports,http://vocab.getty.edu/aat/300027267,United States,http://id.loc.gov/authorities/names/n78095330,Child welfare,http://id.loc.gov/authorities/subjects/sh85023396,Federal aid to child welfare,http://id.loc.gov/authorities/subjects/sh85047559,,,,,,,"University of Tennessee, Knoxville. Libraries",Children's Defense Fund,Langston Hughes Library (Children's Defense Fund Haley Farm),http://id.loc.gov/authorities/names/no2017113530.html,In Copyright - Non-Commercial Use Permitted,http://rightsstatements.org/vocab/InC-NC/1.0/
0116_000050_000385,1995 Nonpartisan Congressional Voting Records,Children's Defense Fund (U.S.),http://id.loc.gov/authorities/names/n80083301,,,,,,,,,1996,28,,,,,Included are the nonpartisan Congressional voting records for key budget votes in 1995 for children,eng,text,reports,http://vocab.getty.edu/aat/300027267,United States,http://id.loc.gov/authorities/names/n78095330,Child welfare,http://id.loc.gov/authorities/subjects/sh85023396,Children's rights,http://id.loc.gov/authorities/subjects/sh85023773,,,,,,,"University of Tennessee, Knoxville. Libraries",Children's Defense Fund,Langston Hughes Library (Children's Defense Fund Haley Farm),http://id.loc.gov/authorities/names/no2017113530.html,In Copyright - Non-Commercial Use Permitted,http://rightsstatements.org/vocab/InC-NC/1.0/
0116_000050_000387,The Health of America's Children,"Rosenbaum, Sara",http://id.loc.gov/authorities/names/n86084486,"Layton, Christine",http://id.loc.gov/authorities/names/n92806095,"Liu, Joseph",http://id.loc.gov/authorities/names/n92806096,,,,,1991,34,,ISSN 10559221,Children's Defense Fund (U.S.),,"This 7th edition of Health of America's Children presents national, international, state, and city statistics on the health of America's children and the adequacy of programs that serve them.",eng,text,reports,http://vocab.getty.edu/aat/300027267,United States,http://id.loc.gov/authorities/names/n78095330,Child health services,http://id.loc.gov/authorities/subjects/sh85023366,Child welfare,http://id.loc.gov/authorities/subjects/sh85023396,Infants--Mortality,http://id.loc.gov/authorities/subjects/sh85066037,,,,,"University of Tennessee, Knoxville. Libraries",Children's Defense Fund,Langston Hughes Library (Children's Defense Fund Haley Farm),http://id.loc.gov/authorities/names/no2017113530.html,In Copyright - Non-Commercial Use Permitted,http://rightsstatements.org/vocab/InC-NC/1.0/
0116_000050_000388,Rate Surveys and Policies: Key Issues for Advocates,"Stoney, Louise",http://id.loc.gov/authorities/names/n89647308,,,,,,,,,1994,13,,,,,"This paper is a companion document to Promoting Access to Quality Child Care: Critical Steps in Conducting Market Rate Surveys and Establishing Rate Policies, which discusses the concept of market rates and the elements involved in coducting an effective market rate survey. This paper discusses the role of providers, CCR&R agencies, community-based organizatiins, and other advocates in responding to market rate surveys and policies.",eng,text,reports,http://vocab.getty.edu/aat/300027267,United States,http://id.loc.gov/authorities/names/n78095330,Child care--Costs,http://id.loc.gov/authorities/subjects/sh00009817,Market surveys,http://id.loc.gov/authorities/subjects/sh85081331,,,,,,,"University of Tennessee, Knoxville. Libraries",Children's Defense Fund,Langston Hughes Library (Children's Defense Fund Haley Farm),http://id.loc.gov/authorities/names/no2017113530.html,In Copyright - Non-Commercial Use Permitted,http://rightsstatements.org/vocab/InC-NC/1.0/
0116_000050_000389,Child Care and Welfare Reform: More Painful Choices,"Ebb, Nancy",http://id.loc.gov/authorities/names/no99034746,,,,,,,,,1995,46,,,,,This report is one in a series of studies examining state policies and practices in child care and early childhood education. The report compares how welfare legislation passed by the Senate in 1995 s some of the basic principles inherent in states' child care costs and the problems and issues states had with meeting the rising costs of providing quality child care for working parents.,eng,text,reports,http://vocab.getty.edu/aat/300027267,United States,http://id.loc.gov/authorities/names/n78095330,Child care services,http://id.loc.gov/authorities/subjects/sh85023355,Working poor,http://id.loc.gov/authorities/subjects/sh00006746,,,,,,,"University of Tennessee, Knoxville. Libraries",Children's Defense Fund,Langston Hughes Library (Children's Defense Fund Haley Farm),http://id.loc.gov/authorities/names/no2017113530.html,In Copyright - Non-Commercial Use Permitted,http://rightsstatements.org/vocab/InC-NC/1.0/
