identifier_adminDB,title,name_author 1,name1_URI,name_author 2,name2_URI,name_author 3,name3_URI,name_author 4,name4_URI,name_author 5,name5_URI,dateIssued,extent,identifier_isbn,identifier_issn,publisher,notes,abstract,language,typeofResource,form,URI_form,subject_geographic,URI_geo,subject_topic_LCSH,URI_topic,subject_topic_LCSH2,URI_topic2,subject_topic_LCSH3,URI_topic3,subject_topic_LCSH4,URI_topic4,subject_topic_NAF,URI_NAF_topic,record_source,project_title,repository,repository_URI,rights,rights URI
0116_000050_000350,Working Together for Children: Head Start and Child Care Partnerships,"Poersch, Nicole",,"Blank, Helen",http://id.loc.gov/authorities/names/n86833543,,,,,,,1996,124,,,Children's Defense Fund (U.S.),,This report was developed during a round table discussion with program directors to discuss issues involved in developing and implementing collaborative partnerships between child care and Head Start. Program directors from 23 child care and Head Start partnerships completed surveys and participated in phone interviews to generate information for this report.,eng,text,reports,http://vocab.getty.edu/aat/300027267,United States,http://id.loc.gov/authorities/names/n78095330,Child welfare,http://id.loc.gov/authorities/subjects/sh85023396 ,Child care,http://id.loc.gov/authorities/subjects/sh85023354,Head Start programs,http://id.loc.gov/authorities/subjects/sh87000100,,,Project Head Start (U.S.),"http://id.loc.gov/authorities/names/n790599176 ","University of Tennessee, Knoxville. Libraries",Children's Defense Fund,Langston Hughes Library (Children's Defense Fund Haley Farm),http://id.loc.gov/authorities/names/no2017113530.html,In Copyright - Non-Commercial Use Permitted,http://rightsstatements.org/vocab/InC-NC/1.0/
0116_000050_000351,Head Start: Helping Families Move from Welfare to Work,"Finlay, Belva",http://id.loc.gov/authorities/names/n92112591,"Blank, Helen",http://id.loc.gov/authorities/names/n86833543," Poersch, Oxendine",,,,,,1998,24,,,Children's Defense Fund (U.S.),,This report describes some of the ways in which Head Start agencies are helping to set parents on the path to self-sufficiency. It illustrates the variety of initiatives that are underway relative to the hundreds of Head Start agencies. The report highlights the important work all Head Start agencies are doing to support parents as they move from welfare to work.,eng,text,reports,http://vocab.getty.edu/aat/300027267,United States,http://id.loc.gov/authorities/names/n78095330,Child welfare,http://id.loc.gov/authorities/subjects/sh85023396 ,Head Start programs,http://id.loc.gov/authorities/subjects/sh87000100,,,,,Project Head Start (U.S.),"http://id.loc.gov/authorities/names/n79059917","University of Tennessee, Knoxville. Libraries",Children's Defense Fund,Langston Hughes Library (Children's Defense Fund Haley Farm),http://id.loc.gov/authorities/names/no2017113530.html,In Copyright - Non-Commercial Use Permitted,http://rightsstatements.org/vocab/InC-NC/1.0/
0116_000050_000352,Healing the Whole Family: A Look at Family Care Programs,"Allen, MaryLee",," Larson, Jamila",,,,,,,,1998,166,ISBN 1881985202,,,,"This report describes 50 family care programs around the country surveyed by CDF. CDF examined programs that treat or serve families struggling with substance abuse, homelessness, domestic violence, and teen parenting. Family care programs were defined as those that allow parents and children to live together in supervised living arrangements for an extended period.",eng,text,reports,http://vocab.getty.edu/aat/300027267,United States,http://id.loc.gov/authorities/names/n78095330,Dysfunctional families,http://id.loc.gov/authorities/subjects/sh85107107,Substance abuse,http://id.loc.gov/authorities/subjects/sh85129539,Family violence,http://id.loc.gov/authorities/subjects/sh85047071,,,,,"University of Tennessee, Knoxville. Libraries",Children's Defense Fund,Langston Hughes Library (Children's Defense Fund Haley Farm),http://id.loc.gov/authorities/names/no2017113530.html,In Copyright - Non-Commercial Use Permitted,http://rightsstatements.org/vocab/InC-NC/1.0/
0116_000050_000353,Child Care Briefing Book,"Adams, Gina",," Poersch, Nicole",,,,,,,,1996,66,,,Children's Defense Fund (U.S.),,"This briefing packet was prepared to provide information on a range of key child care issues. It includes basic facts about child care and its importance to children, families, and communities, as well as information on key legislative issues and proposals affecting child care.",eng,text,reports,http://vocab.getty.edu/aat/300027267,United States,http://id.loc.gov/authorities/names/n78095330,Child care,http://id.loc.gov/authorities/subjects/sh85023354,Child care services--Law and legislation,http://id.loc.gov/authorities/subjects/sh88005563,,,,,,,"University of Tennessee, Knoxville. Libraries",Children's Defense Fund,Langston Hughes Library (Children's Defense Fund Haley Farm),http://id.loc.gov/authorities/names/no2017113530.html,In Copyright - Non-Commercial Use Permitted,http://rightsstatements.org/vocab/InC-NC/1.0/
0116_000050_000354,Enforcing Child Support: Are States Doing the Job?,"Ebb, Nancy",http://id.loc.gov/authorities/names/no99034746,,,,,,,,,1994,73,,,Children's Defense Fund (U.S.),,This CDF report looks at state-by-state child support data to examine the impact of a decade of reform efforts. The report compares data reported by the states to the federal government in FY 1993 and FY 1994 and provides charts for each state to measure progress on key indicators of success for children.,eng,text,reports,http://vocab.getty.edu/aat/300027267,United States,http://id.loc.gov/authorities/names/n78095330,Child support,http://id.loc.gov/authorities/subjects/sh85023394,Child welfare,http://id.loc.gov/authorities/subjects/sh85023396 ,,,,,,,"University of Tennessee, Knoxville. Libraries",Children's Defense Fund,Langston Hughes Library (Children's Defense Fund Haley Farm),http://id.loc.gov/authorities/names/no2017113530.html,In Copyright - Non-Commercial Use Permitted,http://rightsstatements.org/vocab/InC-NC/1.0/
0116_000050_000355,State Child Care Fact Book 1988,"Blank, Helen",http://id.loc.gov/authorities/names/n86833543," Savage, Jennifer",," Wilkins, Amy",,,,,,1988,138,ISBN 938008684,,Children's Defense Fund (U.S.),,"This report contains the findings of CDF's sixth annual survey on child care funding and priorities in the states and documents the urgent need for investment in child care to close the gap between the need for and the supply of safe and affordable child care. The report is divided into five sections: Summary of Findings, Child Care and Welfare Reform: New Opportunities for States, Elements of a Child Care Agenda, 1988 State Child Care Developments, and the Appendixes, which include detailed data about Title XX services, expenditures and reimbursement rates, waiting lists for child care by state, and key child care officials and advocacy centers in each state.",eng,text,reports,http://vocab.getty.edu/aat/300027267,United States,http://id.loc.gov/authorities/names/n78095330,Federal aid to child welfare,http://id.loc.gov/authorities/subjects/sh85047559,Child welfare,http://id.loc.gov/authorities/subjects/sh85023396 ,Child care,http://id.loc.gov/authorities/subjects/sh85023354,,,,,"University of Tennessee, Knoxville. Libraries",Children's Defense Fund,Langston Hughes Library (Children's Defense Fund Haley Farm),http://id.loc.gov/authorities/names/no2017113530.html,In Copyright - Non-Commercial Use Permitted,http://rightsstatements.org/vocab/InC-NC/1.0/
0116_000050_000356,Child Care: The States' Response: A Survey of State Child Care Policies 1983-1984,"Blank, Helen",http://id.loc.gov/authorities/names/n86833543,,,,,,,,,1984,82,,,Children's Defense Fund (U.S.),,"CDF surveyed every state in the country in 1983 to gather information on the nature, quality, and extent of child care serv ices being offered under Title XX of the Social Security Act, the Social Services Block Grant. Title XX is the major source of direct federal funding for child care. CDF published the findings in a study entitled Children and Federal Child Care Cuts: A National Survey of the Impact of Federal Title XX Cuts on State Child Care Systemin Sept. 1983. Since that time, we conducted a second study and updated the findings. This report represents the results of that survey and an agenda that must be implemented if we are to meet the needs of our children and families.",eng,text,reports,http://vocab.getty.edu/aat/300027267,United States,http://id.loc.gov/authorities/names/n78095330,Federal aid to child welfare,http://id.loc.gov/authorities/subjects/sh85047559,Child welfare,http://id.loc.gov/authorities/subjects/sh85023396 ,,,,,,,"University of Tennessee, Knoxville. Libraries",Children's Defense Fund,Langston Hughes Library (Children's Defense Fund Haley Farm),http://id.loc.gov/authorities/names/no2017113530.html,In Copyright - Non-Commercial Use Permitted,http://rightsstatements.org/vocab/InC-NC/1.0/
0116_000050_000357,Child Poverty Data from 1990 Census,Children's Defense Fund (U.S.),http://id.loc.gov/authorities/names/n80083301,,,,,,,,,1992,48,,,Children's Defense Fund (U.S.),,"This report analyzes figures made public by the US Census Bureau. The Census Bureau's definition of ""poverty"" and the definition of ""children"" are given in the report. Data is presented by state for 1979 and 1989 including percentage change in rank. City poverty data for African American and Latino youth is also included in the report as well as the top 20 cities with the highest child poverty rates in 1989.",eng,text,reports,http://vocab.getty.edu/aat/300027267,United States,http://id.loc.gov/authorities/names/n78095330,Poor children,http://id.loc.gov/authorities/subjects/sh85104852,African American youth,http://id.loc.gov/authorities/subjects/sh85001931,Hispanic American youth,http://id.loc.gov/authorities/subjects/sh85061050,,,,,"University of Tennessee, Knoxville. Libraries",Children's Defense Fund,Langston Hughes Library (Children's Defense Fund Haley Farm),http://id.loc.gov/authorities/names/no2017113530.html,In Copyright - Non-Commercial Use Permitted,http://rightsstatements.org/vocab/InC-NC/1.0/
0116_000050_000358,Protecting Our Children: State and Federal Policies for Exempt Child Care Settings,"Blank, Helen",http://id.loc.gov/authorities/names/n86833543,,,,,,,,,1994,85,,,Children's Defense Fund (U.S.),,This report is one in a series of studies by CDF examining state policies in child care and early childhood education. It focuses on state policies for ensuring the health and safety of children enrolled in informal or exempt child care settings who receive federal child care funds.,eng,text,reports,http://vocab.getty.edu/aat/300027267,United States,http://id.loc.gov/authorities/names/n78095330,Family day care,http://id.loc.gov/authorities/subjects/sh85047038,Child care,http://id.loc.gov/authorities/subjects/sh85023354,,,,,,,"University of Tennessee, Knoxville. Libraries",Children's Defense Fund,Langston Hughes Library (Children's Defense Fund Haley Farm),http://id.loc.gov/authorities/names/no2017113530.html,In Copyright - Non-Commercial Use Permitted,http://rightsstatements.org/vocab/InC-NC/1.0/
0116_000050_000359,Promoting Access to Quality Child Care: Critical Steps in Conducting Market Rate Surveys and Establishing Rate Policies,"Stoney, Louise",http://id.loc.gov/authorities/names/n89647308,,,,,,,,,1994,94,,,Children's Defense Fund (U.S.),,"This report is one in a series of studies by CDF examining state policies and practices in child care and early childhood education. It focuses on conducting child care market rate surveys and establishing reimbursement policies that can support quality child care. The ""Market Rates"" concept is explained as well as the ""Market Driven"" approach to the purchase of publicly funded child care services as included in federal initiatives.",eng,text,reports,http://vocab.getty.edu/aat/300027267,United States,http://id.loc.gov/authorities/names/n78095330,Child welfare,http://id.loc.gov/authorities/subjects/sh85023396 ,Child care,http://id.loc.gov/authorities/subjects/sh85023354,,,,,,,"University of Tennessee, Knoxville. Libraries",Children's Defense Fund,Langston Hughes Library (Children's Defense Fund Haley Farm),http://id.loc.gov/authorities/names/no2017113530.html,In Copyright - Non-Commercial Use Permitted,http://rightsstatements.org/vocab/InC-NC/1.0/
0116_000050_000360,The Health of America's Children: Maternal and Child Health Data Book,"Hughes, Dana",http://id.loc.gov/authorities/names/n86121010,"Johnson, Kay",http://id.loc.gov/authorities/names/n84018571,"Rosenbaum, Sara",http://id.loc.gov/authorities/names/n86084486,"Butler, Elizabeth",http://id.loc.gov/authorities/names/n97097347,"Simons, Janet",http://id.loc.gov/authorities/names/n89656041,1988,265,ISBN 938008692,,Children's Defense Fund (U.S.),Adolescent Pregnancy Prevention Prenatal Care Program and CDF,"This report traces prenatal care utilization and other key maternal and child health indicators over time and assesses the nation's failure to ensure adequate care to its most vulnerable citizens. The book examines national, state, and large city infant mortality rates; compares U.S. infant mortality rates with those of other coutries; and assesses American children's and pregnant women's access to health care, patterns of childbearing among teenagers and unmarried women, private insurance coverage for children and pregnant women, and the surgeon general's 1990 Objectives on seven key health indicators.",eng,text,reports,http://vocab.getty.edu/aat/300027267,United States,http://id.loc.gov/authorities/names/n78095330,Child health services,http://id.loc.gov/authorities/subjects/sh85023366,Maternal health services,http://id.loc.gov/authorities/subjects/sh85082102,Maternal and infant welfare ,http://id.loc.gov/authorities/subjects/sh85082098,Infants--Mortality,http://id.loc.gov/authorities/subjects/sh85066037,,,"University of Tennessee, Knoxville. Libraries",Children's Defense Fund,Langston Hughes Library (Children's Defense Fund Haley Farm),http://id.loc.gov/authorities/names/no2017113530.html,In Copyright - Non-Commercial Use Permitted,http://rightsstatements.org/vocab/InC-NC/1.0/
0116_000050_000361,The Health of America's Southern Children: Maternal and Child Health Data Book - Special Edition,"Whitfill, Aileen",,"Liu, Joseph",http://id.loc.gov/authorities/names/n92806096,"Johnson, Kay",http://id.loc.gov/authorities/names/n84018571,,,,,1989,123,ISBN 938008722,,,,"This report documents the progress made and the progress urgently needed now to improve maternal and child health care in the southern states, to save southern infants' and children's lives and health, and to save taxpayer dollars through preventive health care and improved family support. The report brings together a great wealth of information about maternal and child health programs, as well as key health status and health care utilization stats. Key facts on such topics as infant mortality, low birthweight, prenatal care, and childhood mortality are covered, and the presentation of state-by-state fact sheets help provide a summary of health and program statistics.",eng,text,reports,http://vocab.getty.edu/aat/300027267,Southern States,http://id.loc.gov/vocabulary/geographicAreas/n-usu,Child health services,http://id.loc.gov/authorities/subjects/sh85023366,Maternal health services,http://id.loc.gov/authorities/subjects/sh85082102,,,,,,,"University of Tennessee, Knoxville. Libraries",Children's Defense Fund,Langston Hughes Library (Children's Defense Fund Haley Farm),http://id.loc.gov/authorities/names/no2017113530.html,In Copyright - Non-Commercial Use Permitted,http://rightsstatements.org/vocab/InC-NC/1.0/
0116_000050_000362,"Managed Care and Children's Health: An Analysis of Early and Periodic Screening, Diagnosis, and Treatment Services under State Medicaid Managed Care Contracts","Rivera, Lourdes",," Regan, Carol",," Rosenbaum, Sara",,,,,,1995,,,,Children's Defense Fund (U.S.),"Collaboration between National Health Law Program, George Washington Univ., and Center for Health Policy Research","This report examines the intent to which state Medicaid agencies incorporate the various requirements of the EPSDT (Early and Periodic Screening, Diagnosis, and Treatment) Program into contracts with managed care plans. These contracts are the principle document signifying the plans' service obligations. Because EPSDT encompasses such a broad range of services, this report helps make clear which coverage, service, or administrative requirements remain the responsibility of the state agency and out-of-plan providers and which become the duty of managed care plans.",eng,text,reports,http://vocab.getty.edu/aat/300027267,United States,http://id.loc.gov/authorities/names/n78095330,Managed care plans (Medical care),http://id.loc.gov/authorities/subjects/sh87004126,Medicaid,http://id.loc.gov/authorities/subjects/sh85082855,Child health services,http://id.loc.gov/authorities/subjects/sh85023366,,,"Early and Periodic Screening, Diagnosis, and Treatment Program (U.S.)",http://id.loc.gov/authorities/names/n86014229,"University of Tennessee, Knoxville. Libraries",Children's Defense Fund,Langston Hughes Library (Children's Defense Fund Haley Farm),http://id.loc.gov/authorities/names/no2017113530.html,In Copyright - Non-Commercial Use Permitted,http://rightsstatements.org/vocab/InC-NC/1.0/
0116_000050_000363,Child Care Tradeoffs: States Make Painful Choices,"Ebb, Nancy",http://id.loc.gov/authorities/names/no99034746,,,,,,,,,1994,40,,,,,This report contains data that was collected from comprehensive surveys of all 50 states and DC both in 1991 and in the spring/summer of 1993 to collect key data on the states' AFDC (Aid to Families and Dependent Children) child care policies and programs.,eng,text,reports,http://vocab.getty.edu/aat/300027267,United States,http://id.loc.gov/authorities/names/n78095330,Welfare reform,http://id.loc.gov/authorities/names/no2003112232,Child care,http://id.loc.gov/authorities/subjects/sh85023354,Aid to families with dependent children programs,http://id.loc.gov/authorities/subjects/sh89003862,,,,,"University of Tennessee, Knoxville. Libraries",Children's Defense Fund,Langston Hughes Library (Children's Defense Fund Haley Farm),http://id.loc.gov/authorities/names/no2017113530.html,In Copyright - Non-Commercial Use Permitted,http://rightsstatements.org/vocab/InC-NC/1.0/
0116_000050_000364,Summary of the New Welfare Legislation (Public Law 104-193),,,,,,,,,,,1996,27,,,Children's Defense Fund (U.S.),,"This report is a summary of the New Welfare Legislation {P.L. 104-193, the Personal Responsibility and Work Opportunity Reconciliation Act of 1996}, which was passed by Congress and signed into law by President Bill Clinton on Aug. 22, 1996. This new law slashed help for children and families in a broad range of safety net programs. Cuts in federal funds for these programs totaled $54 billion over six years. The New Federal Welfare Law limited welfare to a maximum of five years, restricted food stamp distribution, cut assistance to as many as 300,000 children with disabilities, made it possible to track parents who owed child support payments, and outlined what health benefits children and families could receive.",eng,text,reports,http://vocab.getty.edu/aat/300027267,United States,http://id.loc.gov/authorities/names/n78095330,Public welfare,http://id.loc.gov/authorities/subjects/sh85108846,Child welfare,http://id.loc.gov/authorities/subjects/sh85023396 ,,,,,United States. Personal Responsibility and Work Opportunity Reconciliation Act of 1996,http://id.loc.gov/authorities/names/no96053228,"University of Tennessee, Knoxville. Libraries",Children's Defense Fund,Langston Hughes Library (Children's Defense Fund Haley Farm),http://id.loc.gov/authorities/names/no2017113530.html,In Copyright - Non-Commercial Use Permitted,http://rightsstatements.org/vocab/InC-NC/1.0/
0116_000050_000365,The Nation's Investment in Children: An Analysis of the President's FY 1992 Budget Proposals,Children's Defense Fund (U.S.),http://id.loc.gov/authorities/names/n80083301,,,,,,,,,1991,72,,,,,"This report contains detailed information about the Bush Administration's FY 1992 Budget that affected 12.6 million poor children in our country. Infant mortality rates, homeless children and families, the foster care system, and failing schools are some of the areas covered in the report. Charts and graphs are used throughout the report to highlight the inadequate budget allocations that resulted in little to no improvement to the condition of poor children and families in the US.",eng,text,reports,http://vocab.getty.edu/aat/300027267,United States,http://id.loc.gov/authorities/names/n78095330,Child welfare,http://id.loc.gov/authorities/subjects/sh85023396 ,Federal aid to child welfare,http://id.loc.gov/authorities/subjects/sh85047559,Poor children,http://id.loc.gov/authorities/subjects/sh85104852,,,,,"University of Tennessee, Knoxville. Libraries",Children's Defense Fund,Langston Hughes Library (Children's Defense Fund Haley Farm),http://id.loc.gov/authorities/names/no2017113530.html,In Copyright - Non-Commercial Use Permitted,http://rightsstatements.org/vocab/InC-NC/1.0/
0116_000050_000366,What You Need to Know and Do to Truly Leave No Child Behind,Children's Defense Fund (U.S.). Action Council,http://id.loc.gov/authorities/names/no2004061976,,,,,,,,,2003,49,,,,,"This action guide describes how the Bush budget brings good news to the rich, bad news to the poor, defies the prophets and the gospels, and mocks American values of fair play and opportunity. It analyzes the Bush administration's budget war on children and steps you can take to protect and invest rather than hurt children. Part I outlines our investment choices as a nation. Part II outlines the key provisions of the comprehensive Dodd-Miller Act to Leave No Child Behind (which the CDF Action Council supports), important victories to date, and how it differs from the Bush administration's No Child Left Behind Act. Part III describes the gap between the Bush administration's compassionate words and uncompassionate deeds for children. Part IV provides state-by-state tables on child poverty, child health coverage, and state spending per public school pupil and per priosoner. The Appendix lists a few resources to help you and key action dates.",eng,text,reports,http://vocab.getty.edu/aat/300027267,United States,http://id.loc.gov/authorities/names/n78095330,Child welfare,http://id.loc.gov/authorities/subjects/sh85023396 ,"Education, Elementary",http://id.loc.gov/authorities/subjects/sh85041059,,,,,Project Head Start (U.S.),http://id.loc.gov/authorities/names/n79059917,"University of Tennessee, Knoxville. Libraries",Children's Defense Fund,Langston Hughes Library (Children's Defense Fund Haley Farm),http://id.loc.gov/authorities/names/no2017113530.html,In Copyright - Non-Commercial Use Permitted,http://rightsstatements.org/vocab/InC-NC/1.0/
0116_000050_000367,A Call for Action to Make Our Nation Safe for Children: A Briefing Book on the Status of American Children in 1988,Children's Defense Fund (U.S.),http://id.loc.gov/authorities/names/n80083301,,,,,,,,,1988,41,,,Children's Defense Fund (U.S.),,"This briefing book is designed for all those in public life, child advocates, community activists, professionals, policy makers, parents, citizens, members of the media, and political leaders of all parties seeking office in 1988 and their staffs. Its purpose is to ensure basic social literacy among the media, citizens, and candidates for public office about the facts and needed remedies for American children and families and about the high economic and social costs of child neglect to every American. Part 1 lays out key facts in important areas affecting children and families, the gap in current successful programs for children and families, and the cost-effectiveness of preventive investment. Part 2 includes key charts on the status of families and children with state-by-state date. Part 3 shows how America compares to other nations in protecting its children. The appendix outlines the history of important federal investments in children and youths and summarizes the polls that indicate that helping children in 1988 is not only a moral and practical imperative but is also good politics.",eng,text,reports,http://vocab.getty.edu/aat/300027267,United States,http://id.loc.gov/authorities/names/n78095330,Child welfare,http://id.loc.gov/authorities/subjects/sh85023396 ,Federal aid to child welfare,http://id.loc.gov/authorities/subjects/sh85047559,,,,,,,"University of Tennessee, Knoxville. Libraries",Children's Defense Fund,Langston Hughes Library (Children's Defense Fund Haley Farm),http://id.loc.gov/authorities/names/no2017113530.html,In Copyright - Non-Commercial Use Permitted,http://rightsstatements.org/vocab/InC-NC/1.0/
